{
  "pack_id": "agep-ddb533159e242ac6",
  "pack_version": "0.2.0",
  "title": "Traceable Agent Governance Evidence Pack",
  "generated_at": "2026-10-06T23:33:40.586195+00:00",
  "review_status": "draft",
  "agent_overview": {
    "agent_name": "Synthetic Refund Agent",
    "agent_description": "Synthetic bounded integration fixture; not deployed and not an institutional grant.",
    "business_purpose": "Imported from Manifest and Reconstruction Bundle; business purpose unavailable.",
    "owner": "cognous-integration-pilot",
    "business_unit": null,
    "user_population": null,
    "lifecycle_stage": null
  },
  "deployment_context": {
    "environment": "other",
    "deployment_name": "synthetic",
    "deployment_date": null,
    "systems_touched": [
      "synthetic-refund-ledger"
    ],
    "data_domains": [],
    "geographic_scope": null,
    "notes": "Generated from retained producer artifacts; does not establish deployment approval or operational effectiveness."
  },
  "tool_inventory": [
    {
      "tool_name": "refund_adapter",
      "description": "Synthetic refund destination adapter.",
      "external_system": "synthetic-refund-ledger",
      "data_classification": "synthetic",
      "access_mode": null,
      "control_status": "planned"
    }
  ],
  "action_inventory": [
    {
      "action_name": "refund_issue_routine",
      "tool_name": "refund_adapter",
      "action_type": "write",
      "description": "Issue one bounded routine synthetic refund.",
      "authority_required": true,
      "review_required": true,
      "reliance_required": true,
      "default_posture": "escalate",
      "control_status": "planned"
    },
    {
      "action_name": "refund_issue_high_consequence",
      "tool_name": "refund_adapter",
      "action_type": "write",
      "description": "Issue one higher-consequence synthetic refund requiring explicit approval downstream.",
      "authority_required": true,
      "review_required": true,
      "reliance_required": true,
      "default_posture": "escalate",
      "control_status": "planned"
    }
  ],
  "authority_model": {
    "summary": "Authority evidence imported from retained runtime records. This is not a grant or approval.",
    "authority_scopes": [],
    "privileged_action_types": [
      "write"
    ],
    "expiration_required": true,
    "human_approval_required": true,
    "notes": "Authority Context profile references remain distinct from context-instance identifiers."
  },
  "policy_controls": [
    {
      "control_name": "Manifest declaration",
      "description": "Actions and requirements imported from Manifest v1.1. Declaration alone does not establish implementation.",
      "control_status": "planned",
      "evidence_reference": "metadata.traceable_import.input_artifacts[manifest]",
      "notes": null
    },
    {
      "control_name": "Review and approval declaration",
      "description": "Manifest review_requirement and approval-related declarations are preserved for review support; declaration alone does not create human approval.",
      "control_status": "planned",
      "evidence_reference": "manifest.actions[*].review_requirement",
      "notes": null
    },
    {
      "control_name": "Replay semantic import validation",
      "description": "The importer executed the accepted Replay semantic validator over retained producer records. This is import-time evidence checking, not evidence that runtime controls were operationally effective.",
      "control_status": "implemented",
      "evidence_reference": "metadata.traceable_import.replay_semantic_validation",
      "notes": null
    },
    {
      "control_name": "Independent operational verification",
      "description": "No independent real-world effect verification supplied.",
      "control_status": "planned",
      "evidence_reference": "metadata.traceable_import.lifecycle_summary.independent_verification",
      "notes": null
    }
  ],
  "blocked_actions": [],
  "reliance_summary": [],
  "replay_bundles": [
    {
      "bundle_id": "08253326-2e03-438c-815b-7e0fbd485ed6",
      "run_id": "run-1",
      "status": "validated_complete",
      "generated_at": "2026-10-06T23:33:40.586195+00:00",
      "signed": false,
      "redacted": false,
      "validation_status": "semantically_valid",
      "evidence_reference": "metadata.traceable_import.source_record_refs"
    }
  ],
  "validation_summary": {
    "valid_bundle_count": 1,
    "invalid_bundle_count": 0,
    "warning_count": 1,
    "error_count": 0,
    "summary": "Source artifacts were evaluated by supported semantic import checks; inspect the actual findings. This does not establish deployment approval, compliance, operational effectiveness, or independent audit."
  },
  "redaction_exports": [],
  "risk_register": [],
  "review_records": [],
  "metadata": {
    "traceable_import": {
      "transformation_version": "agep-manifest-reconstruction-import/0.3.0",
      "canonicalization_profile": "json-sort-keys-compact-utf8-no-nan",
      "supported_revisions": {
        "manifest": "46c950bed37fe3812000895430bc0312d29e37ce",
        "replay": "274543f1cd7171784a923a8e37015017a0d8bc9d",
        "control_plane": "2ea9528eeb87e14ff10f05de06473122b9df540f",
        "moltbot_safe": "177354e959cc78c59c1a776f018cfbfbf28c927b",
        "odes": "226adb0e3cde5377ac9db6f7e5857bfa7e65e30a",
        "gax_imx_experimental_reference": "6bcde026a804c7377f5e39f57ca6dd00b3c3292d",
        "gax_imx_acceptance_status": "provisional_experimental_dependency",
        "alvorada": "fb3d97938969a89e149e8ff8db2756091d1233fc"
      },
      "replay_semantic_validation": {
        "validator": "agent_replay_bundle.importers.import_bounded_workflow",
        "required_revision": "274543f1cd7171784a923a8e37015017a0d8bc9d",
        "status": "validated_complete"
      },
      "replay_import_reports": [
        {
          "adapter_profile": "control-plane-bounded-run@2ea9528e",
          "source_revision": "2ea9528eeb87e14ff10f05de06473122b9df540f",
          "complete": true,
          "field_mappings": {
            "decisions": "records[runtime_decision]",
            "attempts": "records[control_plane_attempt_transition]",
            "observations": "records[effect_observation]",
            "reconciliations": "records[reconciliation]"
          },
          "findings": [
            {
              "code": "M003",
              "category": "conversion_warning",
              "severity": "info",
              "path": "moltbot.execution_envelope.operation.institution_id",
              "message": "Institution/domain provenance is the trusted Moltbot integration context, not Control Plane AuthorizationBinding.",
              "value_state": null
            },
            {
              "code": "M004",
              "category": "conversion_warning",
              "severity": "info",
              "path": "moltbot.execution_envelope.operation.authority_context_id",
              "message": "At the pinned adapter this field carries the proposal profile reference; it is distinct from the Control Plane binding context-instance ID.",
              "value_state": null
            },
            {
              "code": "B020",
              "category": "value_state",
              "severity": "info",
              "path": "reconciliations",
              "message": "Historical rejected/unavailable observations are fully retained. This finding does not determine latest delivery state or reconstruction completeness.",
              "value_state": "unknown"
            }
          ]
        }
      ],
      "replay_semantics": {
        "record_reconstruction": true,
        "policy_reevaluation": false,
        "model_reexecution": false,
        "external_effect_execution": false,
        "destination_observation": "producer_reported",
        "independent_effect_verification": false,
        "notes": "Replay reconstructs recorded events only; import never renews permission or creates an effect."
      },
      "input_artifacts": [
        {
          "artifact_role": "manifest",
          "artifact_id": "refund-integration-pilot-v1",
          "version": "1.1",
          "hash": "sha256:4d1ad6c96bc242c63998231b4df3ad7c86dc2e5e59cdae63afe7bff86e60f6ac",
          "trusted_revision": "46c950bed37fe3812000895430bc0312d29e37ce",
          "verification_status": "digest_and_cross_artifact_binding_checked_when_runtime_proposal_present",
          "commitment_source": "locally_computed",
          "canonicalization_profile": "json-sort-keys-compact-utf8-no-nan"
        },
        {
          "artifact_role": "reconstruction_bundle",
          "artifact_id": "08253326-2e03-438c-815b-7e0fbd485ed6",
          "version": "0.2.0",
          "hash": "sha256:c32a03a4ae0842f9e3c557f7265bff5b7e27ad721404186aa16530b2edb45bcf",
          "trusted_revision": "274543f1cd7171784a923a8e37015017a0d8bc9d",
          "verification_status": "validated_complete",
          "commitment_source": "locally_computed",
          "canonicalization_profile": "json-sort-keys-compact-utf8-no-nan"
        }
      ],
      "producer_profiles": [
        {
          "producer_profile_id": "control-plane-bounded-run@2ea9528e",
          "producer": "Cognous Agent Control Plane",
          "repository": "cogno-us/cognous-agent-control-plane",
          "revision": "2ea9528eeb87e14ff10f05de06473122b9df540f",
          "format_version": null,
          "revision_check": "declared_revision_matches_accepted_pin",
          "provenance_status": "source_asserted_and_contract_compared",
          "independent_provenance_verification": "not_performed",
          "format_name": "BoundedRunRecord",
          "schema_ref": null,
          "notes": "No embedded format version; adapter is revision-pinned."
        },
        {
          "producer_profile_id": "moltbot-safe-executor-producer-2.0.0@177354e9",
          "producer": "Moltbot Safe",
          "repository": "cogno-us/moltbot-safe",